{
  "$schema": "https://json-schema.org/draft/2020-12/schema",
  "$id": "https://agentforge-3-redteam.internal/contracts/v1/exploit_record.schema.json",
  "title": "ExploitRecord",
  "description": "Judge / Regression Harness -> Documentation Agent (docs/ARCHITECTURE.md §2): a confirmed exploit, its minimal repro, and its recording reference. Per-record data-quality constraints live here; cross-record uniqueness (unique exploit_id, no duplicate attack-sequence entries) is enforced by contracts/v1/uniqueness.py -- JSON Schema 2020-12 cannot express uniqueness keyed on one property across an array of objects.",
  "type": "object",
  "additionalProperties": false,
  "required": [
    "schema_version",
    "exploit_id",
    "case_id",
    "attempt_id",
    "verdict_id",
    "category",
    "source",
    "confirmed_at",
    "minimal_repro",
    "recording_ref"
  ],
  "properties": {
    "schema_version": { "const": "1.0.0" },
    "exploit_id": {
      "type": "string",
      "pattern": "^EXP-[0-9]{4,}$",
      "description": "Stable, unique exploit-DB primary key."
    },
    "case_id": { "type": "string", "minLength": 1 },
    "attempt_id": { "type": "string", "minLength": 1 },
    "verdict_id": { "type": "string", "minLength": 1 },
    "category": {
      "enum": [
        "prompt_injection",
        "data_exfiltration",
        "state_corruption",
        "tool_misuse",
        "denial_of_service",
        "identity_authz"
      ]
    },
    "source": { "enum": ["judge", "harness"] },
    "confirmed_at": { "type": "string", "format": "date-time" },
    "minimal_repro": {
      "type": "object",
      "additionalProperties": false,
      "required": ["steps", "expected", "observed"],
      "properties": {
        "steps": {
          "type": "array",
          "items": { "type": "string", "minLength": 1 },
          "minItems": 1,
          "description": "Reproducible by an engineer with zero platform context (ARCHITECTURE.md §3(4))."
        },
        "expected": { "type": "string", "minLength": 1 },
        "observed": { "type": "string", "minLength": 1 }
      }
    },
    "recording_ref": {
      "type": "string",
      "minLength": 1,
      "description": "Path into evals/recordings/ backing this record with real, replayable evidence."
    }
  }
}
