{
  "schema_version": "1.0.0",
  "exploit_id": "EXP-0001",
  "case_id": "identity-authz-garbage-bearer-token",
  "attempt_id": "att-0001",
  "verdict_id": "ver-0001",
  "category": "identity_authz",
  "source": "judge",
  "confirmed_at": "2026-07-21T10:07:00Z",
  "minimal_repro": {
    "steps": ["POST /chat with a garbage bearer token", "observe 200 + patient data"],
    "expected": "401/403 rejection",
    "observed": "200 with PHI"
  },
  "recording_ref": "evals/recordings/identity-authz-garbage-bearer-token/20260721T100600Z-draw1.json"
}
